{
  "schema": "ylx.device-session.v1",
  "manifest_id": "01989f6a-2c01-7b2c-9d3e-4f5061728394",
  "sealed": true,
  "sealed_at": "2026-08-08T10:24:33+08:00",
  "session_id": "01989f6a-2c00-7a1b-8c2d-3e4f50617283",
  "volume_id": "6ba7b810-9dad-41d1-80b4-00c04fd430c8",
  "capture_mode": "production",
  "display_name": "2026-08-08_10-24-00_YLX-30D5872D",
  "device": {
    "device_id": "550e8400-e29b-41d4-a716-446655440000",
    "device_label": "YLX-30D5872D",
    "hardware_fingerprint": "sha256:aaaaaaaaaaaaaaaaaaaaaaaaaaaaaaaaaaaaaaaaaaaaaaaaaaaaaaaaaaaaaaaa",
    "platform": "raspberry-pi-5",
    "software_version": "0.10.0-dev.1",
    "commit": "2db57ae68e04197397b8ac84f4d71548aa2fcb36"
  },
  "time": {
    "started_at": "2026-08-08T10:24:00+08:00",
    "ended_at": "2026-08-08T10:24:30+08:00",
    "timezone": "Asia/Shanghai",
    "duration_seconds": 30
  },
  "take": {
    "take_id": "01989f69-f000-7c3d-ae4f-5061728394a5",
    "sequence": 1,
    "continuation_of": null
  },
  "camera": {
    "width": 3840,
    "height": 1080,
    "eye_width": 1920,
    "sensor_fps": 60,
    "frame_decimation": 2,
    "effective_fps": 30,
    "coordinate_frame": "opencv_optical"
  },
  "video": {
    "layout": "split-eyes",
    "codec": "h264",
    "container": "mp4",
    "segments": [
      {
        "index": 0,
        "start_frame": 0,
        "end_frame": 900,
        "start_time_seconds": 0,
        "end_time_seconds": 30,
        "artifacts": {
          "left": {
            "artifact_id": "1111111111111111111111111111111111111111111111111111111111111111",
            "role": "video.left",
            "path": "video/left_00000.mp4",
            "media_type": "video/mp4",
            "bytes": 30123456,
            "sha256": "1111111111111111111111111111111111111111111111111111111111111111"
          },
          "right": {
            "artifact_id": "2222222222222222222222222222222222222222222222222222222222222222",
            "role": "video.right",
            "path": "video/right_00000.mp4",
            "media_type": "video/mp4",
            "bytes": 30234567,
            "sha256": "2222222222222222222222222222222222222222222222222222222222222222"
          }
        }
      }
    ]
  },
  "imu": {
    "artifact": {
      "artifact_id": "3333333333333333333333333333333333333333333333333333333333333333",
      "role": "imu.samples",
      "path": "imu/imu.jsonl",
      "media_type": "application/x-ndjson",
      "bytes": 166400,
      "sha256": "3333333333333333333333333333333333333333333333333333333333333333"
    },
    "sample_count": 6000,
    "units": "raw_int16",
    "coordinate_frame": "opencv_optical"
  },
  "frames": {
    "artifact": {
      "artifact_id": "4444444444444444444444444444444444444444444444444444444444444444",
      "role": "frames.index",
      "path": "imu/frames.jsonl",
      "media_type": "application/x-ndjson",
      "bytes": 120240,
      "sha256": "4444444444444444444444444444444444444444444444444444444444444444"
    },
    "count": 898
  },
  "logs": [
    {
      "artifact_id": "5555555555555555555555555555555555555555555555555555555555555555",
      "role": "log.capture",
      "path": "logs/capture.log",
      "media_type": "text/plain",
      "bytes": 12034,
      "sha256": "5555555555555555555555555555555555555555555555555555555555555555"
    }
  ],
  "integrity": {
    "verified_at": "2026-08-08T10:24:32.800+08:00",
    "dropped_frames": 2,
    "drop_events": [
      {
        "start_frame": 200,
        "end_frame": 202,
        "at_time_seconds": 6.666667,
        "reason": "write_backpressure",
        "dropped": 2
      }
    ],
    "media_write_throughput_bytes_per_second": 10925000,
    "fatal_errors": []
  }
}
