{
  "schema": "ylx.device-session.v1",
  "manifest_id": "0198a200-0002-7002-8000-000000000002",
  "sealed": true,
  "sealed_at": "2026-08-08T14:20:22+08:00",
  "session_id": "0198a200-0001-7001-8000-000000000001",
  "volume_id": "20000001-0000-4001-8000-000000000001",
  "capture_mode": "production",
  "display_name": "2026-08-08_14-20-00_YLX-30D5872D",
  "device": {
    "device_id": "550e8400-e29b-41d4-a716-446655440000",
    "device_label": "YLX-30D5872D",
    "hardware_fingerprint": "sha256:aaaaaaaaaaaaaaaaaaaaaaaaaaaaaaaaaaaaaaaaaaaaaaaaaaaaaaaaaaaaaaaa",
    "platform": "raspberry-pi-5",
    "software_version": "0.10.0-dev.1",
    "commit": "2db57ae68e04197397b8ac84f4d71548aa2fcb36"
  },
  "time": {
    "started_at": "2026-08-08T14:20:00+08:00",
    "ended_at": "2026-08-08T14:20:20+08:00",
    "timezone": "Asia/Shanghai",
    "duration_seconds": 20
  },
  "take": {
    "take_id": "0198a200-0000-7000-8000-000000000000",
    "sequence": 1,
    "continuation_of": null
  },
  "camera": {
    "width": 3840,
    "height": 1080,
    "eye_width": 1920,
    "sensor_fps": 60,
    "frame_decimation": 2,
    "effective_fps": 30,
    "coordinate_frame": "opencv_optical"
  },
  "video": {
    "layout": "split-eyes",
    "codec": "h264",
    "container": "mp4",
    "segments": [
      {
        "index": 0,
        "start_frame": 0,
        "end_frame": 300,
        "start_time_seconds": 0,
        "end_time_seconds": 10,
        "artifacts": {
          "left": {
            "artifact_id": "9999999999999999999999999999999999999999999999999999999999999999",
            "role": "video.left",
            "path": "video/left_00000.mp4",
            "media_type": "video/mp4",
            "bytes": 10123456,
            "sha256": "9999999999999999999999999999999999999999999999999999999999999999"
          },
          "right": {
            "artifact_id": "aaaaaaaaaaaaaaaaaaaaaaaaaaaaaaaaaaaaaaaaaaaaaaaaaaaaaaaaaaaaaaaa",
            "role": "video.right",
            "path": "video/right_00000.mp4",
            "media_type": "video/mp4",
            "bytes": 10234567,
            "sha256": "aaaaaaaaaaaaaaaaaaaaaaaaaaaaaaaaaaaaaaaaaaaaaaaaaaaaaaaaaaaaaaaa"
          }
        }
      },
      {
        "index": 1,
        "start_frame": 300,
        "end_frame": 600,
        "start_time_seconds": 10,
        "end_time_seconds": 20,
        "artifacts": {
          "left": {
            "artifact_id": "bbbbbbbbbbbbbbbbbbbbbbbbbbbbbbbbbbbbbbbbbbbbbbbbbbbbbbbbbbbbbbbb",
            "role": "video.left",
            "path": "video/left_00001.mp4",
            "media_type": "video/mp4",
            "bytes": 10345678,
            "sha256": "bbbbbbbbbbbbbbbbbbbbbbbbbbbbbbbbbbbbbbbbbbbbbbbbbbbbbbbbbbbbbbbb"
          },
          "right": {
            "artifact_id": "cccccccccccccccccccccccccccccccccccccccccccccccccccccccccccccccc",
            "role": "video.right",
            "path": "video/right_00001.mp4",
            "media_type": "video/mp4",
            "bytes": 10456789,
            "sha256": "cccccccccccccccccccccccccccccccccccccccccccccccccccccccccccccccc"
          }
        }
      }
    ]
  },
  "imu": {
    "artifact": {
      "artifact_id": "dddddddddddddddddddddddddddddddddddddddddddddddddddddddddddddddd",
      "role": "imu.samples",
      "path": "imu/imu.jsonl",
      "media_type": "application/x-ndjson",
      "bytes": 112000,
      "sha256": "dddddddddddddddddddddddddddddddddddddddddddddddddddddddddddddddd"
    },
    "sample_count": 4000,
    "units": "raw_int16",
    "coordinate_frame": "opencv_optical"
  },
  "frames": {
    "artifact": {
      "artifact_id": "eeeeeeeeeeeeeeeeeeeeeeeeeeeeeeeeeeeeeeeeeeeeeeeeeeeeeeeeeeeeeeee",
      "role": "frames.index",
      "path": "imu/frames.jsonl",
      "media_type": "application/x-ndjson",
      "bytes": 84000,
      "sha256": "eeeeeeeeeeeeeeeeeeeeeeeeeeeeeeeeeeeeeeeeeeeeeeeeeeeeeeeeeeeeeeee"
    },
    "count": 600
  },
  "logs": [],
  "integrity": {
    "verified_at": "2026-08-08T14:20:21.500+08:00",
    "dropped_frames": 0,
    "drop_events": [],
    "media_write_throughput_bytes_per_second": 8100000,
    "fatal_errors": []
  }
}
